english_title,bengali_title,bengali_version,english_version
On the slope of the desolate river among,কাশের বনে শূণ্য নদীর তীরে,"কাশের বনে শূন্য নদীর তীরে আমি তারে জিজ্ঞাসিলাম ডেকে, ""একলা পথে কে তুমি যাও ধীরে আঁচল-আড়ে প্রদীপখানি ঢেকে। আমার ঘরে হয় নি আলো জ্বালা, দেউটি তব হেথায় রাখো বালা।' গোধূলিতে দুটি নয়ন কালো ক্ষণেক-তরে আমার মুখে তুলে সে কহিল, ""ভাসিয়ে দেব আলো, দিনের শেষে তাই এসেছি কূলে।' চেয়ে দেখি দাঁড়িয়ে কাশের বনে, প্রদীপ ভেসে গেল অকারণে। ভরা সাঁঝে আঁধার হয়ে এলে আমি ডেকে জিজ্ঞাসিলাম তারে, ""তোমার ঘরে সকল আলো জ্বেলে এ দীপখানি সঁপিতে যাও কারে। আমার ঘরে হয় নি আলো জ্বালা, দেউটি তব হেথায় রাখো বালা।' আমার মুখে দুটি নয়ন কালো ক্ষণেক-তরে রইল চেয়ে ভুলে। সে কহিল, ""আমার এ যে আলো আকাশপ্রদীপ শূন্যে দিব তুলে।' চেয়ে দেখি শূন্য গগনকোণে প্রদীপখানি জ্বলে অকারণে। অমাবস্যা আঁধার দুই-পহরে জিজ্ঞাসিলাম তাহার কাছে গিয়ে, ""ওগো, তুমি চলেছ কার তরে প্রদীপখানি বুকের কাছে নিয়ে। আমার ঘরে হয় নি আলো জ্বালা, দেউটি তব হেথায় রাখো বালা।' অন্ধকারে দুটি নয়ন কালো ক্ষণেক মোরে দেখলে চেয়ে তবে, সে কহিল, ""এনেছি এই আলো, দীপালিতে সাজিয়ে দিতে হবে।' চেয়ে দেখি লক্ষ দীপের সনে দীপখানি তার জ্বলে অকারণে।","On the slope of the desolate river among tall grasses I asked her,
""Maiden, where do you go shading your lamp with your mantle? My house
is all dark and lonesome—lend me your light!"" she raised her dark eyes
for a moment and looked at my face through the dusk. ""I have come to
the river,"" she said, ""to float my lamp on the stream when the daylight
wanes in the west."" I stood alone among tall grasses and watched the
timid flame of her lamp uselessly drifting in the tide.

In the silence of gathering night I asked her, ""Maiden, your lights are
all lit—then where do you go with your lamp? My house is all dark and
lonesome—lend me your light."" She raised her dark eyes on my face and
stood for a moment doubtful. ""I have come,"" she said at last, ""to
dedicate my lamp to the sky."" I stood and watched her light uselessly
burning in the void.

In the moonless gloom of midnight I ask her, ""Maiden, what is your
quest, holding the lamp near your heart? My house is all dark and
lonesome—lend me your light."" She stopped for a minute and thought and
gazed at my face in the dark. ""I have brought my light,"" she said, ""to
join the carnival of lamps."" I stood and watched her little lamp
uselessly lost among lights."
"What divine drink wouldst thou have, my God","হে মোর দেবতা, ভরিয়া এ দেহ প্রাণ","হে মোর দেবতা, ভরিয়া এ দেহ প্রাণ কী অমৃত তুমি চাহ করিবারে পান। আমার নয়নে তোমার বিশ্বছবি দেখিয়া লইতে সাধ যায় তব কবি, আমার মুগ্ধ শ্রবণে নীরব রহি শুনিয়া লইতে চাহ আপনার গান। হে মোর দেবতা, ভরিয়া এ দেহ প্রাণ কী অমৃত তুমি চাহ করিবারে পান। আমার চিত্তে তোমার সৃষ্টিখানি রচিয়া তুলিছে বিচিত্র এক বাণী। তারি সাথে প্রভু মিলিয়া তোমার প্রীতি জাগায়ে তুলিছে আমার সকল গীতি, আপনারে তুমি দেখিছ মধুর রসে আমার মাঝারে নিজেরে করিয়া দান। হে মোর দেবতা, ভরিয়া এ দেহ প্রাণ কী অমৃত তুমি চাহ করিবারে পান।","What divine drink wouldst thou have, my God, from this overflowing cup
of my life?

My poet, is it thy delight to see thy creation through my eyes and to
stand at the portals of my ears silently to listen to thine own eternal
harmony?

Thy world is weaving words in my mind and thy joy is adding music to
them. Thou givest thyself to me in love and then feelest thine own
entire sweetness in me."
She who ever had remained in the depth,জীবনে যা চিরদিন,"জীবনে যা চিরদিন রয়ে গেছে আভাসে প্রভাতের আলোকে যা ফোটে নাই প্রকাশে, জীবনের শেষ দানে জীবনের শেষ গানে, হে দেবতা, তাই আজি দিব তব সকাশে, প্রভাতের আলোকে যা ফোটে নাই প্রকাশে। কথা তারে শেষ করে পারে নাই বাঁধিতে, গান তারে সুর দিয়ে পারে নাই সাধিতে। কী নিভৃতে চুপে চুপে মোহন নবীনরূপে নিখিল নয়ন হতে ঢাকা ছিল, সখা, সে। প্রভাতের আলোকে তো ফোটে নাই প্রকাশে। ভ্রমেছি তাহারে লয়ে দেশে দেশে ফিরিয়া, জীবনে যা ভাঙাগড়া সবি তারে ঘিরিয়া। সব ভাবে সব কাজে আমার সবার মাঝে শয়নে স্বপনে থেকে তবু ছিল একা সে। প্রভাতের আলোকে তো ফোটে নাই প্রকাশে। কত দিন কত লোকে গীতাঞ্জলি চেয়েছিল উহারে, বৃথা ফিরে গেছে তারা বাহিরের দুয়ারে। আর কেহ বুঝিবে না, তোমা - সাথে হবে চেনা সেই আশা লয়ে ছিল আপনারি আকাশে, প্রভাতের আলোকে তো ফোটে নাই প্রকাশে।","She who ever had remained in the depth of my being, in the twilight of
gleams and of glimpses; she who never opened her veils in the morning
light, will be my last gift to thee, my God, folded in my final song.

Words have wooed yet failed to win her; persuasion has stretched to her
its eager arms in vain.

I have roamed from country to country keeping her in the core of my
heart, and around her have risen and fallen the growth and decay of my
life.

Over my thoughts and actions, my slumbers and dreams, she reigned yet
dwelled alone and apart.

Many a man knocked at my door and asked for her and turned away in
despair.

There was none in the world who ever saw her face to face, and she
remained in her loneliness waiting for thy recognition."
Thou art the sky and thou art the nest as well,"একাধারে তুমিই আকাশ, তুমিই নীড়","একাধারে তুমিই আকাশ, তুমি নীড়। হে সুন্দর, নীড়ে তব প্রেম সুনিবিড় প্রতি ক্ষণে নানা বর্ণে নানা গন্ধে গীতে মুগ্ধ প্রাণ বেষ্টন করেছে চারি ভিতে। সেথা ঊষা ডান হাতে ধরি স্বর্ণথালা নিয়ে আসে একখানি মাধুর্যের মালা নীরবে পরায়ে দিতে ধরার ললাটে; সন্ধ্যা আসে নম্রমুখে ধেনুশূন্য মাঠে চিহ্নহীন পথ দিয়ে লয়ে স্বর্ণঝারি পশ্চিমসমুদ্র হতে ভরি শান্তিবারি। তুমি যেথা আমাদের আত্মার আকাশ, অপার সঞ্চারক্ষেত্র, সেথা শুভ্র ভাস; দিন নাই, রাত নাই, নাই জনপ্রাণী, বর্ণ নাই, গন্ধ নাই--নাই নাই বাণী।","Thou art the sky and thou art the nest as well.

O thou beautiful, there in the nest is thy love that encloses the soul
with colours and sounds and odours.

There comes the morning with the golden basket in her right hand
bearing the wreath of beauty, silently to crown the earth.

And there comes the evening over the lonely meadows deserted by herds,
through trackless paths, carrying cool draughts of peace in her golden
pitcher from the western ocean of rest.

But there, where spreads the infinite sky for the soul to take her
flight in, reigns the stainless white radiance. There is no day nor
night, nor form nor colour, and never, never a word."
Thy sunbeam comes upon this earth of mine,তব রবিকর আসে কর বাড়াইয়া,"তব রবিকর আসে কর বাড়াইয়া এ আমার ধরণীতে। সারাদিন দ্বারে রহে কেন দাঁড়াইয়া কী আছে কী চায় নিতে। রাতের আঁধারে ফিরে যায় যবে, জানি নিয়ে যায় বহি মেঘ-আবরণখানি, নয়নের জলে রচিত ব্যাকুল বাণী খচিত ললিত গীতে। নব নব রূপে বরণে বরণে ভরি বুকে লহ তুলি সেই মেঘ-উত্তরী। লঘু সে চপল কোমল শ্যামল কালো, হে নিরঞ্জন, নাই বাস তারে ভালো, তারে দিয়ে তুমি ঢাক আপনার আলো সকরুণ ছায়াটিতে।","Thy sunbeam comes upon this earth of mine with arms outstretched and
stands at my door the livelong day to carry back to thy feet clouds
made of my tears and sighs and songs.

With fond delight thou wrappest about thy starry breast that mantle of
misty cloud, turning it into numberless shapes and folds and colouring
it with hues everchanging.

It is so light and so fleeting, tender and tearful and dark, that is
why thou lovest it, O thou spotless and serene. And that is why it may
cover thy awful white light with its pathetic shadows."
The same stream of life that runs,এ আমার শিরায় শিরায়,"এ আমার শরীরের শিরায় শিরায় যে প্রাণ-তরঙ্গমালা রাত্রিদিন ধায় সেই প্রাণ ছুটিয়াছে বিশ্বদিগ্‌বিজয়ে, সেই প্রাণ অপরূপ ছন্দে তালে লয়ে নাচিছে ভুবনে; সেই প্রাণ চুপে চুপে বসুধার মৃত্তিকার প্রতি রোমকূপে লক্ষ লক্ষ তৃণে তৃণে সঞ্চারে হরষে, বিকাশে পল্লবে পুষ্পে-- বরষে বরষে বিশ্বব্যাপী জন্মমৃত্যুসমুদ্রদোলায় দুলিতেছে অন্তহীন জোয়ার-ভাঁটায়। করিতেছি অনুভব, সে অনন্ত প্রাণ অঙ্গে অঙ্গে আমারে করেছে মহীয়ান। সেই যুগযুগান্তের বিরাট স্পন্দন আমার নাড়ীতে আজি করিছে নর্তন।","The same stream of life that runs through my veins night and day runs
through the world and dances in rhythmic measures.

It is the same life that shoots in joy through the dust of the earth in
numberless blades of grass and breaks into tumultuous waves of leaves
and flowers.

It is the same life that is rocked in the ocean-cradle of birth and of
death, in ebb and in flow.

I feel my limbs are made glorious by the touch of this world of life.
And my pride is from the life-throb of ages dancing in my blood this
moment."
Is it beyond thee to be glad with,পারবি না কি যোগ দিতে এই ছন্দে রে,"পারবি না কি যোগ দিতে এই ছন্দে রে, খসে যাবার ভেসে যাবার ভাঙবারই আনন্দে রে। পাতিয়া কান শুনিস না যে দিকে দিকে গগনমাঝে মরণবীণায় কী সুর বাজে তপন-তারা-চন্দ্রে রে জ্বালিয়ে আগুন ধেয়ে ধেয়ে জ্বলবারই আনন্দে রে। পাগল-করা গানের তানে ধায় যে কোথা কেই-বা জানে, চায় না ফিরে পিছন-পানে রয় না বাঁধা বন্ধে রে লুটে যাবার ছুটে যাবার চলবারই আনন্দে রে। সেই আনন্দ-চরণপাতে ছয় ঋতু যে নৃত্যে মাতে, প্লাবন বহে যায় ধরাতে বরন গীতে গন্ধে রে ফেলে দেবার ছেড়ে দেবার মরবারই আনন্দে রে।","Is it beyond thee to be glad with the gladness of this rhythm? to be
tossed and lost and broken in the whirl of this fearful joy?

All things rush on, they stop not, they look not behind, no power can
hold them back, they rush on.

Keeping steps with that restless, rapid music, seasons come dancing and
pass away—colours, tunes, and perfumes pour in endless cascades in the
abounding joy that scatters and gives up and dies every moment."
That I should make much of myself,আমি আমায় করব বড়,"আমি আমায় করব বড়ো এই তো আমার মায়া— তোমার আলো রাঙিয়ে দিয়ে ফেলব রঙিন ছায়া। তুমি তোমায় রাখবে দূরে, ডাকবে তারে নানা সুরে, আপনারি বিরহ তোমার আমায় নিল কায়া। বিরহ-গান উঠল বেজে বিশ্বগগনময়। কত রঙের কান্নাহাসি কতই আশা-ভয়। কত যে ঢেউ ওঠে পড়ে, কত স্বপন ভাঙে গড়ে, আমার মাঝে রচিলে যে আপন পরাজয়। এই যে তোমার আড়ালখানি দিলে তুমি ঢাকা, দিবানিশির তুলি দিয়ে হাজার ছবি আঁকা— এরি মাঝে আপনাকে যে বাঁধা রেখে বসলে সেজে, সোজা কিছু রাখলে না, সব মধুর বাঁকে বাঁকা। আকাশ জুড়ে আজ লেগেছে তোমার আমার মেলা। দূরে কাছে ছড়িয়ে গেছে তোমার আমার খেলা। তোমার আমার গুঞ্জরণে বাতাস মাতে কুঞ্জবনে, তোমার আমার যাওয়া-আসায় কাটে সকল বেলা।","That I should make much of myself and turn it on all sides, thus
casting coloured shadows on thy radiance—such is thy _maya_.

Thou settest a barrier in thine own being and then callest thy severed
self in myriad notes. This thy self-separation has taken body in me.

The poignant song is echoed through all the sky in many-coloured tears
and smiles, alarms and hopes; waves rise up and sink again, dreams
break and form. In me is thy own defeat of self.

This screen that thou hast raised is painted with innumerable figures
with the brush of the night and the day. Behind it thy seat is woven in
wondrous mysteries of curves, casting away all barren lines of
straightness.

The great pageant of thee and me has overspread the sky. With the tune
of thee and me all the air is vibrant, and all ages pass with the
hiding and seeking of thee and me."
"He it is, the innermost one",কে গো অন্তরতর সে,"কে গো অন্তরতর সে। আমার চেতনা আমার বেদনা তারি সুগভীর পরশে। আঁখিতে আমার বুলায় মন্ত্র, বাজায় হৃদয়বীণার তন্ত্র, কত আনন্দে জাগায় ছন্দ কত সুখে দুখে হরষে। সোনালি রুপালি সবুজে সুনীলে সে এমন মায়া কেমনে গাঁথিলে, তারি সে আড়ালে চরণ বাড়ালে ডুবালে সে সুধাসরসে। কত দিন আসে কত যুগ যায় গোপনে গোপনে পরান ভুলায়, নানা পরিচয়ে নানা নাম লয়ে নিতি নিতি রস বরষে।","He it is, the innermost one, who awakens my being with his deep hidden
touches.

He it is who puts his enchantment upon these eyes and joyfully plays on
the chords of my heart in varied cadence of pleasure and pain.

He it is who weaves the web of this _maya_ in evanescent hues of gold
and silver, blue and green, and lets peep out through the folds his
feet, at whose touch I forget myself.

Days come and ages pass, and it is ever he who moves my heart in many a
name, in many a guise, in many a rapture of joy and of sorrow."
Deliverance is not for me in renunciation,"বৈরাগ্য সাধনে মুক্তি, সে আমার নয়","বৈরাগ্যসাধনে মুক্তি, সে আমার নয়। অসংখ্যবন্ধন-মাঝে মহানন্দময় লভিব মুক্তির স্বাদ। এই বসুধার মৃত্তিকার পাত্রখানি ভরি বারম্বার তোমার অমৃত ঢালি দিবে অবিরত নানাবর্ণগন্ধময়। প্রদীপের মতো সমস্ত সংসার মোর লক্ষ বর্তিকায় জ্বালায়ে তুলিবে আলো তোমারি শিখায় তোমার মন্দির-মাঝে। ইন্দ্রিয়ের দ্বার রুদ্ধ করি যোগাসন,সে নহে আমার। যে কিছু আনন্দ আছে দৃশ্যে গন্ধে গানে তোমার আনন্দ রবে তার মাঝখানে। মোহ মোর মুক্তিরূপে উঠিবে জ্বলিয়া, প্রেম মোর ভক্তিরূপে রহিবে ফলিয়া।","Deliverance is not for me in renunciation. I feel the embrace of
freedom in a thousand bonds of delight.

Thou ever pourest for me the fresh draught of thy wine of various
colours and fragrance, filling this earthen vessel to the brim.

My world will light its hundred different lamps with thy flame and
place them before the altar of thy temple.

No, I will never shut the doors of my senses. The delights of sight and
hearing and touch will bear thy delight.

Yes, all my illusions will burn into illumination of joy, and all my
desires ripen into fruits of love."
"The day is no more, the shadow is upon the earth",আর নাই রে বেলা নামল ছায়া,"আর নাই রে বেলা, নামল ছায়া ধরণীতে। এখন চল্‌ রে ঘাটে কলসখানি ভরে নিতে। জলধারার কলস্বরে সন্ধ্যাগগন আকুল করে, ওরে, ডাকে আমায় পথের 'পরে সেই ধ্বনিতে॥ এখন বিজন পথে করে না কেউ আসা যাওয়া ওরে, প্রেমনদীতে উঠেছে ঢেউ, উতল হাওয়া জানি নে আর ফিরব কিনা, কার সাথে আজ হবে চিনা-- ঘাটে সেই অজানা বাজায় বীণা তরণীতে॥","The day is no more, the shadow is upon the earth. It is time that I go
to the stream to fill my pitcher.

The evening air is eager with the sad music of the water. Ah, it calls
me out into the dusk. In the lonely lane there is no passer-by, the
wind is up, the ripples are rampant in the river.

I know not if I shall come back home. I know not whom I shall chance to
meet. There at the fording in the little boat the unknown man plays
upon his lute."
Thy gifts to us mortals fulfill all our needs,"মর্ত্যবাসীদের তুমি যা দিয়েছ, প্রভু","মর্তবাসীদের তুমি যা দিয়েছ প্রভু, মর্তের সকল আশা মিটাইয়া তবু রিক্ত তাহা নাহি হয়। তার সর্বশেষ আপনি খুঁজিয়া ফিরে তোমারি উদ্দেশ। নদী ধায় নিত্যকাজে, সর্ব কর্ম সারি অন্তহীন ধারা তার চরণে তোমারি নিত্য জলাঞ্জলিরূপে ঝরে অনিবার। কুসুম আপন গন্ধে সমস্ত সংসার সম্পূর্ণ করিয়া তবু সম্পূর্ণ না হয়-- তোমারি পূজায় তার শেষ পরিচয়। সংসারে বঞ্চিত করি তব পূজা নহে। কবি আপনার গানে যত কথা কহে নানা জনে লহে তার নানা অর্থ টানি, তোমা-পানে ধায় তার শেষ অর্থখানি।","Thy gifts to us mortals fulfill all our needs and yet run back to thee
undiminished.

The river has its everyday work to do and hastens through fields and
hamlets; yet its incessant stream winds towards the washing of thy
feet.

The flower sweetens the air with its perfume; yet its last service is
to offer itself to thee.

Thy worship does not impoverish the world.

From the words of the poet men take what meanings please them; yet
their last meaning points to thee."
"Day after day, O lord of my life","প্রতিদিন আমি, হে জীবনস্বামী","প্রতিদিন আমি হে জীবনস্বামী, দাঁড়াব তোমারি সম্মুখে। করি জোড়কর, হে ভুবনেশ্বর, দাঁড়াব তোমারি সম্মুখে। তোমার অপার আকাশের তলে বিজনে বিরলে হে-- নম্র হৃদয়ে নয়নের জলে দাঁড়াব তোমারি সম্মুখে। তোমার বিচিত্র এ ভবসংসারে কর্মপারাবারপারে হে, নিখিলজগৎজনের মাঝারে দাঁড়াব তোমারি সম্মুখে। তোমার এ ভবে মোর কাজ যবে সমাপন হবে হে, ওগো রাজরাজ, একাকী নীরবে দাঁড়াব তোমারি সম্মুখে।","Day after day, O lord of my life, shall I stand before thee face to
face. With folded hands, O lord of all worlds, shall I stand before
thee face to face.

Under thy great sky in solitude and silence, with humble heart shall I
stand before thee face to face.

In this laborious world of thine, tumultuous with toil and with
struggle, among hurrying crowds shall I stand before thee face to face.

And when my work shall be done in this world, O King of kings, alone
and speechless shall I stand before thee face to face."
