english_title,bengali_title,bengali_version,english_version
"Beautiful is thy wristlet, decked with stars",সুন্দর বটে তব অঙ্গদখানি,"সুন্দর বটে তব অঙ্গদখানি তারায় তারায় খচিত, স্বর্ণে রত্নে শোভন লোভন জানি বর্ণে বর্ণে রচিত। খড়্ গ তোমার আরো মনোহর লাগে বাঁকা বিদ্যুতে আঁকা সে, গরুড়ের পাখা রক্তরবির রাগে যেন গো অস্ত-আকাশে। জীবন-শেষের শেষ জাগরণসম ঝলসিছে মহাবেদনা- নিমেষে দহিয়া যাহা-কিছু আছে মম তীব্র ভীষণ চেতনা। সুন্দর বটে তব অঙ্গদখানি তারায় তারায় খচিত- খড়গ তোমার,হে দেব বজ্রপাণি, চরম শোভায় রচিত।","Beautiful is thy wristlet, decked with stars and cunningly wrought in
myriad-coloured jewels. But more beautiful to me thy sword with its
curve of lightning like the outspread wings of the divine bird of
Vishnu, perfectly poised in the angry red light of the sunset.

It quivers like the one last response of life in ecstasy of pain at the
final stroke of death; it shines like the pure flame of being burning
up earthly sense with one fierce flash.

Beautiful is thy wristlet, decked with starry gems; but thy sword, O
lord of thunder, is wrought with uttermost beauty, terrible to behold
or think of."
I asked nothing from thee,তোমার কাছে চাইনি কিছু,"তোমার কাছে চাই নি কিছু, জানাই নি মোর নাম-- তুমি যখন বিদায় নিলে নীরব রহিলাম। একলা ছিলেম কুয়ার ধারে নিমের ছায়াতলে, কলস নিয়ে সবাই তখন পাড়ায় গেছে চলে। আমায় তারা ডেকে গেল, ""আয় গো, বেলা যায়।' কোন্‌ আলসে রইনু বসে কিসের ভাবনায়। পদধ্বনি শুনি নাইকো কখন তুমি এলে। কইলে কথা ক্লান্তকণ্ঠে করুণ চক্ষু মেলে-- ""তৃষাকাতর পান্থ আমি'-- শুনে চমকে উঠে জলের ধারা দিলেম ঢেলে তোমার করপুটে। মর্মরিয়া কাঁপে পাতা, কোকিল কোথা ডাকে, বাবলা ফুলের গন্ধ ওঠে পল্লীপথের বাঁকে। যখন তুমি শুধালে নাম পেলেম বড়ো লাজ, তোমার মনে থাকার মতো করেছি কোন্‌ কাজ। তোমায় দিতে পেরেছিলেম একটু তৃষার জল, এই কথাটি আমার মনে রহিল সম্বল। কুয়ার ধারে দুপুরবেলা তেমনি ডাকে পাখি, তেমনি কাঁপে নিমের পাতা-- আমি বসেই থাকি।","I asked nothing from thee; I uttered not my name to thine ear. When
thou took’st thy leave I stood silent. I was alone by the well where
the shadow of the tree fell aslant, and the women had gone home with
their brown earthen pitchers full to the brim. They called me and
shouted, ""Come with us, the morning is wearing on to noon."" But I
languidly lingered awhile lost in the midst of vague musings.

I heard not thy steps as thou camest. Thine eyes were sad when they
fell on me; thy voice was tired as thou spokest low—""Ah, I am a thirsty
traveller."" I started up from my day-dreams and poured water from my
jar on thy joined palms. The leaves rustled overhead; the cuckoo sang
from the unseen dark, and perfume of _babla_ flowers came from the bend
of the road.

I stood speechless with shame when my name thou didst ask. Indeed, what
had I done for thee to keep me in remembrance? But the memory that I
could give water to thee to allay thy thirst will cling to my heart and
enfold it in sweetness. The morning hour is late, the bird sings in
weary notes, _neem_ leaves rustle overhead and I sit and think and
think."
Languor is upon your heart and the slumber,এখনো ঘোর ভাঙে না তোর যে,"এখনো ঘোর ভাঙে না তোর যে মেলে না তোর আঁখি, কাঁটার বনে ফুল ফুটেছে রে জানিস নে তুই তা কি। ওরে অলস, জানিস নে তুই তা কি। জাগো এবার জাগো, বেলা কাটাস না গো। কঠিন পথের শেষে কোথায় অগম বিজন দেশে ও সেই বন্ধু আমার একলা আছে গো, দিস নে তারে ফাঁকি। চিরজীবন দিস নে তারে ফাঁকি। জাগো এবার জাগো, বেলা কাটাস না গো। প্রখর রবির তাপে নাহয় শুষ্ক গগন কাঁপে, নাহয় দগ্ধ বালু তপ্ত আঁচলে দিক চারি দিক ঢাকি। পিপাসাতে দিক চারি দিক ঢাকি। মনের মাঝে চাহি দেখ্ রে আনন্দ কি নাহি। পথে পায়ে পায়ে দুখের বাঁশরি বাজবে তোরে ডাকি। মধুর সুরে বাজবে তোরে ডাকি। জাগো এবার জাগো, বেলা কাটাস না গো।","Languor is upon your heart and the slumber is still on your eyes.

Has not the word come to you that the flower is reigning in splendour
among thorns? Wake, oh awaken! let not the time pass in vain!

At the end of the stony path, in the country of virgin solitude, my
friend is sitting all alone. Deceive him not. Wake, oh awaken!

What if the sky pants and trembles with the heat of the midday sun—what
if the burning sand spreads its mantle of thirst—

Is there no joy in the deep of your heart? At every footfall of yours,
will not the harp of the road break out in sweet music of pain?"
Thus it is that thy joy in me is so full,তাই তোমার আনন্দ আমার পর,"তাই তোমার আনন্দ আমার 'পর তুমি তাই এসেছ নীচে। আমায় নইলে ত্রিভুবনেশ্বর, তোমার প্রেম হত যে মিছে। আমায় নিয়ে মেলেছ এই মেলা, আমার হিয়ায় চলছে রসের খেলা, মোর জীবনে বিচিত্ররূপ ধরে তোমার ইচ্ছা তরঙ্গিছে॥ তাই তো তুমি রাজার রাজা হয়ে তব আমার হৃদয় লাগি ফিরছ কত মনোহরণ-বেশে প্রভু, নিত্য আছ জাগি। তাই তো, প্রভু, হেথায় এল নেমে, তোমারি প্রেম ভক্তপ্রাণের প্রেমে, মূর্তি তোমার যুগল-সম্মিলনে সেথায় পূর্ণ প্রকাশিছে॥","Thus it is that thy joy in me is so full. Thus it is that thou hast
come down to me. O thou lord of all heavens, where would be thy love if
I were not?

Thou hast taken me as thy partner of all this wealth. In my heart is
the endless play of thy delight. In my life thy will is ever taking
shape.

And for this, thou who art the King of kings hast decked thyself in
beauty to captivate my heart. And for this thy love loses itself in the
love of thy lover, and there art thou seen in the perfect union of two."
"Light, my light, the world-filling light","আলো আমার আলো, ওগো","আলো আমার, আলো ওগো, আলো ভুবন-ভরা। আলো নয়ন-ধোওয়া আমার, আলো হৃদয়-হরা॥ নাচে আলো নাচে, ও ভাই, আমার প্রাণের কাছে-- বাজে আলো বাজে, ও ভাই হৃদয়বীণার মাঝে-- জাগে আকাশ, ছোটে বাতাস, হাসে সকল ধরা॥ আলোর স্রোতে পাল তুলেছে হাজার প্রজাপতি। আলোর ঢেউয়ে উঠল নেচে মল্লিকা মালতী। মেঘে মেঘে সোনা, ও ভাই, যায় না মানিক গোনা-- পাতায় পাতায় হাসি, ও ভাই, পুলক রাশি রাশি-- সুরনদীর কূল ডুবেছে সুধা-নিঝর-ঝরা॥","Light, my light, the world-filling light, the eye-kissing light,
heart-sweetening light!

Ah, the light dances, my darling, at the centre of my life; the light
strikes, my darling, the chords of my love; the sky opens, the wind
runs wild, laughter passes over the earth.

The butterflies spread their sails on the sea of light. Lilies and
jasmines surge up on the crest of the waves of light.

The light is shattered into gold on every cloud, my darling, and it
scatters gems in profusion.

Mirth spreads from leaf to leaf, my darling, and gladness without
measure. The heaven’s river has drowned its banks and the flood of joy
is abroad."
Let all the strains of joy,যেন শেষ গানে মোর সব রাগিণী পূরে,"যেন শেষ গানে মোর সব রাগিণী পূরে — আমার সব আনন্দ মেলে তাহার সুরে। যে আনন্দে মাটির ধরা হাসে অধীর হয়ে তরুলতায় ঘাসে, যে আনন্দে দুই পাগলের মতো জীবন-মরণ বেড়ায় ভুবন ঘুরে — সেই আনন্দ মেলে তাহার সুরে। যে আনন্দ আসে ঝড়ের বেশে, ঘুমন্ত প্রাণ জাগায় অট্টহেসে। যে আনন্দ দাঁড়ায় আঁখিজলে দুঃখ-ব্যথার রক্তশতদলে, যা আছে সব ধুলায় ফেলে দিয়ে যে আনন্দে বচন নাহি ফুরে সেই আনন্দ মেলে তাহার সুরে।","Let all the strains of joy mingle in my last song—the joy that makes
the earth flow over in the riotous excess of the grass, the joy that
sets the twin brothers, life and death, dancing over the wide world,
the joy that sweeps in with the tempest, shaking and waking all life
with laughter, the joy that sits still with its tears on the open red
lotus of pain, and the joy that throws everything it has upon the dust,
and knows not a word."
"Yes, I know, this is nothing but thy love","এই তো তোমার প্রেম, ওগো","এই তো তোমার প্রেম, ওগো হৃদয়হরণ। এই-যে পাতায় আলো নাচে সোনার বরন। এই-যে মধুর আলসভরে মেঘ ভেসে যায় আকাশ- ' পরে, এই-যে বাতাস দেহে করে অমৃত ক্ষরণ। এই তো তোমার প্রেম, ওগো হৃদয়হরণ। প্রভাত-আলোর ধারায় আমার নয়ন ভেসেছে। এই তোমারি প্রেমের বাণী প্রাণে এসেছে। তোমারি মুখ ওই নুয়েছে, মুখে আমার চোখ থুয়েছে, আমার হৃদয় আজ ছুঁয়েছে তোমারি চরণ।","Yes, I know, this is nothing but thy love, O beloved of my heart— this
golden light that dances upon the leaves, these idle clouds sailing
across the sky, this passing breeze leaving its coolness upon my
forehead.

The morning light has flooded my eyes—this is thy message to my heart.
Thy face is bent from above, thy eyes look down on my eyes, and my
heart has touched thy feet."
On the seashore of endless worlds children meet,জগৎ পারাবারের তীরে,"জগৎ-পারাবারের তীরে ছেলেরা করে মেলা। অন্তহীন গগনতল মাথার 'পরে অচঞ্চল, ফেনিল ওই সুনীল জল নাচিছে সারা বেলা। উঠিছে তটে কী কোলাহল-- ছেলেরা করে মেলা। বালুকা দিয়ে বাঁধিছে ঘর, ঝিনুক নিয়ে খেলা। বিপুল নীল সলিল-'পরি ভাসায় তারা খেলার তরী আপন হাতে হেলায় গড়ি পাতায়-গাঁথা ভেলা। জগৎ-পারাবারের তীরে ছেলেরা করে খেলা। জানে না তারা সাঁতার দেওয়া, জানে না জাল ফেলা। ডুবারি ডুবে মুকুতা চেয়ে, বণিক ধায় তরণী বেয়ে, ছেলেরা নুড়ি কুড়ায়ে পেয়ে সাজায় বসি ঢেলা। রতন ধন খোঁজে না তারা, জানে না জাল ফেলা। ফেনিয়ে উঠে সাগর হাসে, হাসে সাগর-বেলা। ভীষণ ঢেউ শিশুর কানে রচিছে গাথা তরল তানে, দোলনা ধরি যেমন গানে জননী দেয় ঠেলা। সাগর খেলে শিশুর সাথে, হাসে সাগর-বেলা। জগৎ-পারাবারের তীরে ছেলেরা করে মেলা। ঝঞ্ঝা ফিরে গগনতলে, তরণী ডুবে সুদূর জলে, মরণ-দূত উড়িয়া চলে, ছেলেরা করে খেলা। জগৎ-পারাবারের তীরে শিশুর মহামেলা।","On the seashore of endless worlds children meet. The infinite sky is
motionless overhead and the restless water is boisterous. On the
seashore of endless worlds the children meet with shouts and dances.

They build their houses with sand and they play with empty shells. With
withered leaves they weave their boats and smilingly float them on the
vast deep. Children have their play on the seashore of worlds.

They know not how to swim, they know not how to cast nets. Pearl
fishers dive for pearls, merchants sail in their ships, while children
gather pebbles and scatter them again. They seek not for hidden
treasures, they know not how to cast nets.

The sea surges up with laughter and pale gleams the smile of the sea
beach. Death-dealing waves sing meaningless ballads to the children,
even like a mother while rocking her baby’s cradle. The sea plays with
children, and pale gleams the smile of the sea beach.

On the seashore of endless worlds children meet. Tempest roams in the
pathless sky, ships get wrecked in the trackless water, death is abroad
and children play. On the seashore of endless worlds is the great
meeting of children."
The sleep that flits on baby's eyes,খোকার চোখে যে ঘুম আসে সকল তাপনাশা,"খোকার চোখে যে ঘুম আসে সকল-তাপ-নাশা-- জান কি কেউ কোথা হতে যে করে সে যাওয়া-আসা। শুনেছি রূপকথার গাঁয়ে জোনাকি-জ্বলা বনের ছায়ে দুলিছে দুটি পারুল-কুঁড়ি, তাহারি মাঝে বাসা-- সেখান থেকে খোকার চোখে করে সে যাওয়া-আসা। খোকার ঠোঁটে যে হাসিখানি চমকে ঘুমঘোরে-- কোন্‌ দেশে যে জনম তার কে কবে তাহা মোরে। শুনেছি কোন্‌ শরৎ-মেঘে শিশু-শশীর কিরণ লেগে সে হাসিরুচি জনমি ছিল শিশিরশুচি ভোরে-- খোকার ঠোঁটে যে হাসিখানি চমকে ঘুমঘোরে। খোকার গায়ে মিলিয়ে আছে যে কচি কোমলতা-- জান কি সে যে এতটা কাল লুকিয়ে ছিল কোথা। মা যবে ছিল কিশোরী মেয়ে করুণ তারি পরান ছেয়ে মাধুরীরূপে মুরছি ছিল কহে নি কোনো কথা-- খোকার গায়ে মিলিয়ে আছে যে কচি কোমলতা। আশিস আসি পরশ করে খোকারে ঘিরে ঘিরে-- জান কি কেহ কোথা হতে সে বরষে তার শিরে। ফাগুনে নব মলয়শ্বাসে, শ্রাবণে নব নীপের বাসে, আশিনে নব ধান্যদলে, আষাড়ে নব নীরে-- আশিস আসি পরশ করে খোকারে ঘিরে ঘিরে। এই-যে খোকা তরুণতনু নতুন মেলে আঁখি-- ইহার ভার কে লবে আজি তোমরা জান তা কি। হিরণময় কিরণ-ঝোলা যাঁহার এই ভুবন-দোলা তপন-শশী-তারার কোলে দেবেন এরে রাখি-- এই-যে খোকা তরুণতনু নতুন মেলে আঁখি।","The sleep that flits on baby's eyes—does anybody know from where it
comes? Yes, there is a rumour that it has its dwelling there, in the
fairy village among shadows of the forest dimly lit with glow-worms,
there hang two timid buds of enchantment. From there it comes to kiss
baby’s eyes.

The smile that flickers on baby’s lips when he sleeps—does anybody know
where it was born? Yes, there is a rumour that a young pale beam of a
crescent moon touched the edge of a vanishing autumn cloud, and there
the smile was first born in the dream of a dew-washed morning—the smile
that flickers on baby’s lips when he sleeps.

The sweet, soft freshness that blooms on baby’s limbs—does anybody know
where it was hidden so long? Yes, when the mother was a young girl it
lay pervading her heart in tender and silent mystery of love—the sweet,
soft freshness that has bloomed on baby’s limbs."
"When I bring to you coloured toys, my child",রঙিন খেলেনা দিলে ও রাঙা হাতে,"রঙিন খেলেনা দিলে ও রাঙা হাতে তখন বুঝি রে বাছা, কেন যে প্রাতে এত রঙ খেলে মেঘে জলে রঙ ওঠে জেগে, কেন এত রঙ লেগে ফুলের পাতে— রাঙা খেলা দেখি যবে ও রাঙা হাতে। গান গেয়ে তোরে আমি নাচাই যবে আপন হৃদয়-মাঝে বুঝি রে তবে, পাতায় পাতায় বনে ধ্বনি এত কী কারণে, ঢেউ বহে নিজমনে তরল রবে, বুঝি তা তোমারে গান শুনাই যবে। যখন নবনী দিই লোলুপ করে হাতে মুখে মেখেচুকে বেড়াও ঘরে, তখন বুঝিতে পারি স্বাদু কেন নদীবারি, ফল মধুরসে ভারী কিসের তরে, যখন নবনী দিই লোলুপ করে। যখন চুমিয়ে তোর বদনখানি হাসিটি ফুটায়ে তুলি তখনি জানি আকাশ কিসের সুখে আলো দেয় মোর মুখে, বায়ু দিয়ে যায় বুকে অমৃত আনি— বুঝি তা চুমিলে তোর বদনখানি।","When I bring to you coloured toys, my child, I understand why there is
such a play of colours on clouds, on water, and why flowers are painted
in tints—when I give coloured toys to you, my child.

When I sing to make you dance I truly now why there is music in leaves,
and why waves send their chorus of voices to the heart of the listening
earth—when I sing to make you dance.

When I bring sweet things to your greedy hands I know why there is
honey in the cup of the flowers and why fruits are secretly filled with
sweet juice—when I bring sweet things to your greedy hands.

When I kiss your face to make you smile, my darling, I surely
understand what pleasure streams from the sky in morning light, and
what delight that is that is which the summer breeze brings to my
body—when I kiss you to make you smile."
Thou hast made me known to friends,কত অজানারে জানাইলে তুমি,"কত অজানারে জানাইলে তুমি, কত ঘরে দিলে ঠাঁই — দূরকে করিলে নিকট, বন্ধু, পরকে করিলে ভাই। পুরানো আবাস ছেড়ে যাই যবে মনে ভেবে মরি কী জানি কী হবে, নূতনের মাঝে তুমি পুরাতন সে কথা যে ভুলে যাই। দূরকে করিলে নিকট, বন্ধু, পরকে করিলে ভাই। জীবনে মরণে নিখিল ভুবনে যখনি যেখানে লবে, চিরজনমের পরিচিত ওহে, তুমিই চিনাবে সবে। তোমারে জানিলে নাহি কেহ পর, নাহি কোনো মানা, নাহি কোনো ডর ; সবারে মিলায়ে তুমি জাগিতেছ, দেখা যেন সদা পাই। দূরকে করিলে নিকট, বন্ধু, পরকে করিলে ভাই।","Thou hast made me known to friends whom I knew not. Thou hast given me
seats in homes not my own. Thou hast brought the distant near and made
a brother of the stranger.

I am uneasy at heart when I have to leave my accustomed shelter; I
forget that there abides the old in the new, and that there also thou
abidest.

Through birth and death, in this world or in others, wherever thou
leadest me it is thou, the same, the one companion of my endless life
who ever linkest my heart with bonds of joy to the unfamiliar.

When one knows thee, then alien there is none, then no door is shut.
Oh, grant me my prayer that I may never lose the bliss of the touch of
the one in the play of many."
