english_title,bengali_title,bengali_version,english_version
By all means they try to hold me secure,সংসারেতে আর যাহারা,"সংসারেতে আর-যাহারা আমায় ভালোবাসে তারা আমায় ধরে রাখে বেঁধে কঠিন পাশে। তোমার প্রেম যে সবার বাড়া তাই তোমারি নূতন ধারা, বাঁধ নাকো, লুকিয়ে থাক' ছেড়েই রাখ দাসে। আর-সকলে, ভুলি পাছে তাই রাখে না একা। দিনের পরে কাটে যে দিন, তোমারি নেই দেখা। তোমায় ডাকি নাই বা ডাকি, যা খুশি তাই নিয়ে থাকি; তোমার খুশি চেয়ে আছে আমার খুশির আশে।","By all means they try to hold me secure who love me in this world. But
it is otherwise with thy love which is greater than theirs, and thou
keepest me free.

Lest I forget them they never venture to leave me alone. But day passes
by after day and thou art not seen.

If I call not thee in my prayers, if I keep not thee in my heart, thy
love for me still waits for my love."
When it was day they came into my house,তারা দিনের বেলা এসেছিল,"তারা দিনের বেলা এসেছিল আমার ঘরে, বলেছিল, একটি পাশে রইব প'ড়ে। বলেছিল, দেবতাসেবায় আমরা হব তোমার সহায় — যা - কিছু পাই প্রসাদ লব পূজার পরে। এমনি করে দরিদ্র ক্ষীণ মলিন বেশে সংকোচেতে একটি কোণে রইল এসে। রাতে দেখি প্রবল হয়ে পশে আমার দেবালয়ে, মলিন হাতে পূজার বলি হরণ করে।","When it was day they came into my house and said, ""We shall only take
the smallest room here.""

They said, ""We shall help you in the worship of your God and humbly
accept only our own share in his grace""; and then they took their seat
in a corner and they sat quiet and meek.

But in the darkness of night I find they break into my sacred shrine,
strong and turbulent, and snatch with unholy greed the offerings from
God’s altar."
Let only that little be left of me,তোমায় আমার প্রভু করে রাখি,"তোমায় আমার প্রভু করে রাখি আমার আমি সেইটুকু থাক্ বাকি। তোমায় আমি হেরি সকল দিশি, সকল দিয়ে তোমার মাঝে মিশি, তোমারে প্রেম জোগাই দিবানিশি, ইচ্ছা আমার সেইটুকু থাক্ বাকি — তোমায় আমার প্রভু করে রাখি। তোমায় আমি কোথাও নাহি ঢাকি কেবল আমার সেইটুকু থাক্ বাকি। তোমার লীলা হবে এ প্রাণ ভরে এ সংসারে রেখেছ তাই ধরে, রইব বাঁধা তোমার বাহুডোরে বাঁধন আমার সেইটুকু থাক্ বাকি — তোমায় আমার প্রভু করে রাখি।","Let only that little be left of me whereby I may name thee my all.

Let only that little be left of my will whereby I may feel thee on
every side, and come to thee in everything, and offer to thee my love
every moment.

Let only that little be left of me whereby I may never hide thee.

Let only that little of my fetters be left whereby I am bound with thy
will, and thy purpose is carried out in my life—and that is the fetter
of thy love."
Where the mind is without fear,চিত্ত যেথা ভয়শুণ্য,"চিত্ত যেথা ভয়শূন্য, উচ্চ যেথা শির, জ্ঞান যেথা মুক্ত, যেথা গৃহের প্রাচীর আপন প্রাঙ্গণতলে দিবসশর্বরী বসুধারে রাখে নাই খন্ড ক্ষুদ্র করি, যেথা বাক্য হৃদয়ের উৎসমুখ হতে উচ্ছ্বসিয়া উঠে, যেথা নির্বারিত স্রোতে দেশে দেশে দিশে দিশে কর্মধারা ধায় অজস্র সহস্রবিধ চরিতার্থতায়-- যেথা তুচ্ছ আচারের মরুবালুরাশি বিচারের স্রোতঃপথ ফেলে নাই গ্রাসি, পৌরুষেরে করে নি শতধা; নিত্য যেথা তুমি সর্ব কর্ম চিন্তা আনন্দের নেতা-- নিজ হস্তে নির্দয় আঘাত করি, পিতঃ, ভারতেরে সেই স্বর্গে করো জাগরিত।","Where the mind is without fear and the head is held high;

Where knowledge is free;

Where the world has not been broken up into fragments by narrow
domestic walls;

Where words come out from the depth of truth;

Where tireless striving stretches its arms towards perfection;

Where the clear stream of reason has not lost its way into the dreary
desert sand of dead habit;

Where the mind is led forward by thee into ever-widening thought and
action—

Into that heaven of freedom, my Father, let my country awake."
"This is my prayer to thee, my lord",তব কাছে এই মোর শেষ নিবেদন,"তব কাছে এই মোর শেষ নিবেদন — সকল ক্ষীণতা মম করহ ছেদন দৃঢ়বলে, অন্তরের অন্তর হইতে প্রভু মোর। বীর্য দেহো সুখের সহিতে, সুখেরে কঠিন করি। বীর্য দেহো দুখে, যাহে দুঃখ আপনারে শান্তস্মিত মুখে পারে উপেক্ষিতে। ভকতিরে। বীর্য দেহো কর্মে যাহে হয় সে সফল, প্রীতি স্নেহ পুণ্যে ওঠে ফুটি। বীর্য দেহো ক্ষুদ্র জনে না করিতে হীনজ্ঞান, বলের চরণে না লুটিতে। বীর্য দেহো চিত্তেরে একাকী প্রত্যহের তুচ্ছতার ঊর্ধ্বে দিতে রাখি। বীর্য দেহো তোমার চরণে পাতি শির অহর্নিশি আপনারে রাখিবারে স্থির।","This is my prayer to thee, my lord—strike, strike at the root of penury
in my heart.

Give me the strength lightly to bear my joys and sorrows.

Give me the strength to make my love fruitful in service.

Give me the strength never to disown the poor or bend my knees before
insolent might.

Give me the strength to raise my mind high above daily trifles.

And give me the strength to surrender my strength to thy will with
love."
I thought that my voyage had come to its end,ভেবেছিনু মনে যা হবার তারি শেষে,"ভেবেছিনু মনে যা হবার তারি শেষে যাত্রা আমার বুঝি থেমে গেছে এসে। নাই বুঝি পথ, নাই বুঝি আর কাজ, পাথেয় যা ছিল ফুরায়েছে বুঝি আজ, যেতে হবে সরে নীরব অন্তরালে জীর্ণ জীবনে ছিন্ন মলিন বেশে। কী নিরখি আজি, এ কী অফুরান লীলা, এ কী নবীনতা বহে অন্তঃশীলা। পুরাতন ভাষা মরে এল যবে মুখে, নবগান হয়ে গুমরি উঠিল বুকে, পুরাতন পথ শেষ হয়ে গেল যেথা সেথায় আমারে আনিলে নূতন দেশে।","I thought that my voyage had come to its end at the last limit of my
power,—that the path before me was closed, that provisions were
exhausted and the time come to take shelter in a silent obscurity.

But I find that thy will knows no end in me. And when old words die out
on the tongue, new melodies break forth from the heart; and where the
old tracks are lost, new country is revealed with its wonders."
"That I want thee, only thee",চাই গো আমি তোমারে চাই,"চাই গো আমি তোমারে চাই তোমায় আমি চাই — এই কথাটি সদাই মনে বলতে যেন পাই। আর যা-কিছু বাসনাতে ঘুরে বেড়াই দিনে রাতে মিথ্যা সে-সব মিথ্যা ওগো তোমায় আমি চাই। রাত্রি যেমন লুকিয়ে রাখে আলোর প্রার্থনাই — তেমনি গভীর মোহের মাঝে তোমায় আমি চাই। শান্তিরে ঝড় যখন হানে শান্তি তবু চায় সে প্রাণে, তেমনি তোমায় আঘাত করি তবু তোমায় চাই।","That I want thee, only thee—let my heart repeat without end. All
desires that distract me, day and night, are false and empty to the
core.

As the night keeps hidden in its gloom the petition for light, even
thus in the depth of my unconsciousness rings the cry—I want thee, only
thee.

As the storm still seeks its end in peace when it strikes against peace
with all its might, even thus my rebellion strikes against thy love and
still its cry is—I want thee, only thee."
When the heart is hard and parched up,জীবন যখন শুকায়ে যায়,"জীবন যখন শুকায়ে যায় করুণাধারায় এসো। সকল মাধুরী লুকায়ে যায়, গীতসুধারসে এসো। কর্ম যখন প্রবল-আকার গরজি উঠিয়া ঢাকে চারি ধার, হৃদয়প্রান্তে হে নীরব নাথ, শান্তচরণে এসো। আপনারে যবে করিয়া কৃপণ কোণে পড়ে থাকে দীনহীন মন, দুয়ার খুলিয়া হে উদার নাথ, রাজ-সমারোহে এসো। বাসনা যখন বিপুল ধুলায় অন্ধ করিয়া অবোধে ভুলায় ওহে পবিত্র, ওহে অনিদ্র, রুদ্র আলোকে এসো।","When the heart is hard and parched up, come upon me with a shower of
mercy.

When grace is lost from life, come with a burst of song.

When tumultuous work raises its din on all sides shutting me out from
beyond, come to me, my lord of silence, with thy peace and rest.

When my beggarly heart sits crouched, shut up in a corner, break open
the door, my king, and come with the ceremony of a king.

When desire blinds the mind with delusion and dust, O thou holy one,
thou wakeful, come with thy light and thy thunder."
The rain has held back for days and days,"দীর্ঘকাল, অনাবৃষ্টি, অতি দীর্ঘকাল,","দীর্ঘকাল অনাবৃষ্টি, অতি দীর্ঘকাল, হে ইন্দ্র, হৃদয়ে মম। দিক্‌চক্রবাল ভয়ংকার শূন্য হেরি, নাই কোনোখানে সরস সজল রেখা-- কেহ নাহি আনে নববারিবর্ষনের শ্যামল সংবাদ। যদি ইচ্ছা হয়, দেব, আনো বজ্রনাদ প্রলয়মুখর হিংস্র ঝটিকার সাথে। পলে পলে বিদ্যুতের বক্র কশাঘাতে সচকিত করো মোর দিগ্‌দিগন্তর। সংহরো সংহরো, প্রভো, নিস্তব্ধ প্রখর এই রুদ্র, এই ব্যাপ্ত, এ নিঃশব্দ দাহ নিঃসহ নৈরাশ্যতাপ। চাহো নাথ, চাহো জননী যেমন চাহে সজল নয়ানে পিতার ক্রোধের দিনে সন্তানের পানে।","The rain has held back for days and days, my God, in my arid heart. The
horizon is fiercely naked—not the thinnest cover of a soft cloud, not
the vaguest hint of a distant cool shower.

Send thy angry storm, dark with death, if it is thy wish, and with
lashes of lightning startle the sky from end to end.

But call back, my lord, call back this pervading silent heat, still and
keen and cruel, burning the heart with dire despair.

Let the cloud of grace bend low from above like the tearful look of the
mother on the day of the father’s wrath."
Where dost thou stand behind them all,কোথা ছায়ার কোনে দাঁড়িয়ে তুমি কিসের প্রতীক্ষায়,"কোথা ছায়ার কোণে দাঁড়িয়ে তুমি কিসের প্রতীক্ষায় কেন আছ সবার পিছে। যারা ধুলা-পায়ে ধায় গো পথে, তোমায় ঠেলে যায়, তারা তোমায় ভাবে মিছে। আমি তোমার লাগি কুসুম তুলি, বসি তরুর মূলে, আমি সাজিয়ে রাখি ডালি-- ওগো, যে আসে সেই একটি-দুটি নিয়ে যে যায় তুলে, আমার সাজি হয় যে খালি। ওগো, সকাল গেল, বিকাল গেল, সন্ধ্যা হয়ে আসে, চোখে লাগছে ঘুমঘোর। সবাই ঘরের পানে যাবার বেলা আমায় দেখে হাসে, মনে লজ্জা লাগে মোর। আমি বসে আছি বসনখানি টেনে মুখের 'পরে যেন ভিখারিনীর মতো-- কেহ শুধায় যদি 'কী চাও তুমি' থাকি নিরুত্তরে করি দুটি নয়ন নত। আজি কোন্‌ লাজে বা বলব আমি 'তোমায় শুধু চাহি', আমি বলব কেমন করে-- শুধু তোমারি পথ চেয়ে আমি রজনী দিন বাহি, তুমি আসবে আমার তরে। আমার দৈন্যখানি যত্নে রাখি, রাজৈশ্বর্যে তব তারে দিব বিসর্জন-- ওগো, অভাগিনীর এ অভিমান কাহার কাছে কব, তাহা রইল সংগোপন। আমি সুদূর-পানে চেয়ে চেয়ে ভাবি আপন-মনে হেথা তৃণে আসন মেলে-- তুমি হঠাৎ কখন আসবে হেথায় বিপুল আয়োজনে তোমার সকল আলো জ্বেলে। তোমার রথের 'পরে সোনার ধ্বজা ঝলবে ঝলমল, সাথে বাজবে বাঁশির তান-- তোমার প্রতাপ-ভরে বসুন্ধরা করবে টলমল, আমার উঠবে নেচে প্রাণ। তখন পথের লোকে অবাক হয়ে সবাই চেয়ে রবে, তুমি নেমে আসবে পথে; হেসে দু হাত ধরে ধুলা হতে আমায় তুলে লবে-- তুমি লবে তোমার রথে। আমার ভূষণবিহীন মলিন বেশে ভিখারিনীর সাজে তোমার দাঁড়াব বাম পাশে, তখন লতার মতো কাঁপব আমি গর্বে সুখে লাজে সকল বিশ্বের সকাশে। ওগো, সময় বয়ে যাচ্ছে চলে, রয়েছি কান পেতে-- কোথা কই গো চাকার ধ্বনি। তোমার এ পথ দিয়ে কত-না লোক গর্বে গেল মেতে কতই জাগিয়ে রনরনি। তবে তুমিই কি গো নীরব হয়ে রবে ছায়ার তলে, তুমি রবে সবার শেষে-- হেথায় ভিখারিনীর লজ্জা কি গো ঝরবে নয়নজলে। তারে রাখবে মলিন বেশে?","Where dost thou stand behind them all, my lover, hiding thyself in the
shadows? They push thee and pass thee by on the dusty road, taking thee
for naught. I wait here weary hours spreading my offerings for thee,
while passers-by come and take my flowers, one by one, and my basket is
nearly empty.

The morning time is past, and the noon. In the shade of evening my eyes
are drowsy with sleep. Men going home glance at me and smile and fill
me with shame. I sit like a beggar maid, drawing my skirt over my face,
and when they ask me, what it is I want, I drop my eyes and answer them
not.

Oh, how, indeed, could I tell them that for thee I wait, and that thou
hast promised to come. How could I utter for shame that I keep for my
dowry this poverty. Ah, I hug this pride in the secret of my heart.

I sit on the grass and gaze upon the sky and dream of the sudden
splendour of thy coming—all the lights ablaze, golden pennons flying
over thy car, and they at the roadside standing agape, when they see
thee come down from thy seat to raise me from the dust, and set at thy
side this ragged beggar girl a-tremble with shame and pride, like a
creeper in a summer breeze.

But time glides on and still no sound of the wheels of thy chariot.
Many a procession passes by with noise and shouts and glamour of glory.
Is it only thou who wouldst stand in the shadow silent and behind them
all? And only I who would wait and weep and wear out my heart in vain
longing?"
Early in the day it was whispered that,কথা ছিল এক-তরীতে কেবল তুমি আমি,"কথা ছিল এক-তরীতে কেবল তুমি আমি যাব অকারণে ভেসে কেবল ভেসে, ত্রিভুবনে জানবে না কেউ আমরা তীর্থগামী কোথায় যেতেছি কোন্ দেশে সে কোন্ দেশে। কূলহারা সেই সমুদ্র-মাঝখানে শোনাব গান একলা তোমার কানে, ঢেউয়ের মতন ভাষা-বাঁধন-হারা আমার সেই রাগিণী শুনবে নীরব হেসে। আজো সময় হয় নি কি তার, কাজ কি আছে বাকি। ওগো ওই-যে সন্ধ্যা নামে সাগরতীরে। মলিন আলোয় পাখা মেলে সিন্ধুপারের পাখি আপন কুলায়-মাঝে সবাই এল ফিরে। কখন তুমি আসবে ঘাটের'পরে বাঁধনটুকু কেটে দেবার তরে। অস্তরবির শেষ আলোটির মতো তরী নিশীথমাঝে যাবে নিরুদ্দেশে।","Early in the day it was whispered that we should sail in a boat, only
thou and I, and never a soul in the world would know of this our
pilgrimage to no country and to no end.

In that shoreless ocean, at thy silently listening smile my songs would
swell in melodies, free as waves, free from all bondage of words.

Is the time not come yet? Are there works still to do? Lo, the evening
has come down upon the shore and in the fading light the seabirds come
flying to their nests.

Who knows when the chains will be off, and the boat, like the last
glimmer of sunset, vanish into the night?"
The day was when I did not keep myself,"তখন করি নি নাথ, কোন আয়োজন","তখন করি নি, নাথ, কোনো আয়োজন; বিশ্বের সবার সাথে, হে বিশ্বরাজন‌, অজ্ঞাতে আসিতে হাসি আমার অন্তরে কত শুভদিনে; কত মুহূর্তের 'পরে অসীমের চিহ্ন লিখে গেছ! লই তুলি তোমার স্বাক্ষর-আঁকা সেই ক্ষণগুলি-- দেখি তারা স্মৃতি-মাঝে আছিল ছড়ায়ে কত-না ধূলির সাথে,আছিল জড়ায়ে ক্ষণিকের কত তুচ্ছ সুখদুঃখ ঘিরে! হে নাথ, অবজ্ঞা করি যাও নাই ফিরে আমার সে ধুলাস্তূপ খেলাঘর দেখে! খেলা-মাঝে শুনিতে পেয়েছি থেকে থেকে যে চরণধ্বনি--আজ শুনি তাই বাজে জগৎসংগীত-সাথে চন্দ্রসূর্য-মাঝে।","The day was when I did not keep myself in readiness for thee; and
entering my heart unbidden even as one of the common crowd, unknown to
me, my king, thou didst press the signet of eternity upon many a
fleeting moment of my life.

And today when by chance I light upon them and see thy signature, I
find they have lain scattered in the dust mixed with the memory of joys
and sorrows of my trivial days forgotten.

Thou didst not turn in contempt from my childish play among dust, and
the steps that I heard in my playroom are the same that are echoing
from star to star."
"This is my delight, thus to wait and watch",আমার এই পথ চাওয়াতেই আনন্দ,"আমার এই পথ-চাওয়াতেই আনন্দ। খেলে যায় রৌদ্র ছায়া, বর্ষা আসে বসন্ত ॥ কারা এই সমুখ দিয়ে আসে যায় খবর নিয়ে, খুশি রই আপন মনে-- বাতাস বহে সুমন্দ ॥ সারাদিন আঁখি মেলে দুয়ারে রব একা, শুভখন হঠাৎ এলে তখনি পাব দেখা। ততখন ক্ষণে ক্ষণে হাসি গাই আপন-মনে, ততখন রহি রহি ভেসে আসে সুগন্ধ ॥","This is my delight, thus to wait and watch at the wayside where shadow
chases light and the rain comes in the wake of the summer.

Messengers, with tidings from unknown skies, greet me and speed along
the road. My heart is glad within, and the breath of the passing breeze
is sweet.

From dawn till dusk I sit here before my door, and I know that of a
sudden the happy moment will arrive when I shall see.

In the meanwhile I smile and I sing all alone. In the meanwhile the air
is filling with the perfume of promise."
